tile_number,section,title,visualization,report_name,primary_metric,baseline_cases,baseline_share,default_market,date_cutoff,drill_through,notes
1,Launch Complaint Categories,HBO Max Activation Errors,Donut,W5 Complaints - 01 - HBO Max Activation Errors,Case count by error type,94,63%,"UK, Ireland",2026-03-26,Yes,Segments: wrong email / renew subscription loop / something went wrong. Sky Q Glass Stream customers.
2,Launch Complaint Categories,TNT Sports — HBO Entertainment Access Confusion,Horizontal bar,W5 Complaints - 02 - TNT Sports HBO Entertainment Access Confusion,Case count by scenario variant,18,12%,"UK, Ireland",2026-03-26,Yes,Bars: landed on Basic tier / Get Access locked. Sky TNT Sports subscribers. DTC hybrid billing path exists but non-obvious.
3,Launch Complaint Categories,Region Lock / Out-of-Region Error,Stacked bar,W5 Complaints - 03 - Region Lock Out of Region Error,Case count by market and account origin,11,7%,"UK, Ireland",2026-03-26,Yes,Stack: market (UK vs IE). Legacy VPN or US-region accounts. Requires account-level region reset.
4,Launch Complaint Categories,Discovery+ Credentials Not Recognised,Donut,W5 Complaints - 04 - Discovery Plus Credentials Not Recognised,Case count by resolution path,11,7%,"UK, Ireland",2026-03-26,Yes,Segments: redirected to Sky portal / new account created / unresolved. D+ creds do not transfer.
5,Launch Complaint Categories,Double Accounts / Consolidation Queries,Horizontal bar,W5 Complaints - 05 - Double Accounts Consolidation Queries,Case count by account source pair,10,7%,"UK, Ireland",2026-03-26,Yes,Bars: EE+Sky / BT+Sky. No self-serve consolidation path.
